{
  "schema": 1,
  "generated": true,
  "generated_from": [
    "config/capability-taxonomy.json",
    "config/employees.json",
    "config/capabilities.json",
    "config/integrations.json",
    "config/upstream-sources.json",
    "config/skill-provenance.json",
    "skills/hermes-custom/*/SKILL.md"
  ],
  "taxonomy": {
    "kinds": [
      "skill",
      "tool",
      "mcp",
      "plugin",
      "extension",
      "workflow",
      "memory",
      "hook",
      "adapter",
      "policy"
    ],
    "usage_modes": [
      "original",
      "copied-with-license",
      "adapted",
      "recreated-concepts",
      "optional-upstream-dependency",
      "reference-only",
      "excluded-license-boundary",
      "provider-neutral-contract"
    ],
    "default_states": [
      "BUNDLED",
      "NOT_INSTALLED",
      "REFERENCE_ONLY",
      "NOT_CONNECTED"
    ],
    "risk_classes": [
      "PROCEDURAL",
      "READ_ONLY",
      "EXTERNAL_WRITE",
      "PAID_ACTION",
      "ACCOUNT_CHANGE",
      "DESTRUCTIVE",
      "MEMORY"
    ],
    "platforms": [
      "windows",
      "linux",
      "macos",
      "unspecified"
    ]
  },
  "capabilities": [
    {
      "id": "adapter.runtime-readonly",
      "kind": "adapter",
      "description": "Read-only runtime adapter contract for local runtimes without granting write or dispatch authority.",
      "source_refs": [
        {
          "source_id": "project:nyobakantorai",
          "source_commit": null,
          "license": "MIT"
        }
      ],
      "usage_mode": "original",
      "default_state": "BUNDLED",
      "risk_class": "READ_ONLY",
      "required_by": [],
      "optional_for": [
        "praroro",
        "paijo",
        "subagjo",
        "alex",
        "sumiati",
        "siti",
        "maya",
        "gugun",
        "ratri",
        "bimo",
        "nara",
        "dina",
        "bambang",
        "fikri",
        "tari",
        "caca"
      ],
      "platforms": [
        "windows",
        "linux",
        "macos"
      ],
      "install_method": "bundled package",
      "verification_method": "runtime-adapter positive/negative/timeout tests",
      "artifact_ref": "packages/runtime-adapter/index.mjs"
    },
    {
      "id": "ads.google.creative",
      "kind": "adapter",
      "description": "Google Ads creative draft/inspection",
      "source_refs": [
        {
          "source_id": "project:nyobakantorai",
          "source_commit": null,
          "license": "MIT"
        }
      ],
      "usage_mode": "provider-neutral-contract",
      "default_state": "NOT_CONNECTED",
      "risk_class": "READ_ONLY",
      "required_by": [],
      "optional_for": [
        "gugun"
      ],
      "platforms": [
        "unspecified"
      ],
      "install_method": "provider-specific; see linked optional integrations",
      "verification_method": "provider evidence_ref + employee scope + autonomy/approval router",
      "artifact_ref": "config/capabilities.json"
    },
    {
      "id": "ads.google.insights",
      "kind": "adapter",
      "description": "Google Ads performance insights",
      "source_refs": [
        {
          "source_id": "project:nyobakantorai",
          "source_commit": null,
          "license": "MIT"
        }
      ],
      "usage_mode": "provider-neutral-contract",
      "default_state": "NOT_CONNECTED",
      "risk_class": "READ_ONLY",
      "required_by": [],
      "optional_for": [
        "gugun"
      ],
      "platforms": [
        "unspecified"
      ],
      "install_method": "provider-specific; see linked optional integrations",
      "verification_method": "provider evidence_ref + employee scope + autonomy/approval router",
      "artifact_ref": "config/capabilities.json"
    },
    {
      "id": "ads.google.keywords",
      "kind": "adapter",
      "description": "Google Ads keyword/search-term operations",
      "source_refs": [
        {
          "source_id": "project:nyobakantorai",
          "source_commit": null,
          "license": "MIT"
        }
      ],
      "usage_mode": "provider-neutral-contract",
      "default_state": "NOT_CONNECTED",
      "risk_class": "READ_ONLY",
      "required_by": [],
      "optional_for": [
        "gugun"
      ],
      "platforms": [
        "unspecified"
      ],
      "install_method": "provider-specific; see linked optional integrations",
      "verification_method": "provider evidence_ref + employee scope + autonomy/approval router",
      "artifact_ref": "config/capabilities.json"
    },
    {
      "id": "ads.google.read",
      "kind": "adapter",
      "description": "Google Ads account/campaign read",
      "source_refs": [
        {
          "source_id": "project:nyobakantorai",
          "source_commit": null,
          "license": "MIT"
        }
      ],
      "usage_mode": "provider-neutral-contract",
      "default_state": "NOT_CONNECTED",
      "risk_class": "READ_ONLY",
      "required_by": [],
      "optional_for": [
        "gugun"
      ],
      "platforms": [
        "unspecified"
      ],
      "install_method": "provider-specific; see linked optional integrations",
      "verification_method": "provider evidence_ref + employee scope + autonomy/approval router",
      "artifact_ref": "config/capabilities.json"
    },
    {
      "id": "ads.google.verify",
      "kind": "adapter",
      "description": "Post-mutation Google Ads verification",
      "source_refs": [
        {
          "source_id": "project:nyobakantorai",
          "source_commit": null,
          "license": "MIT"
        }
      ],
      "usage_mode": "provider-neutral-contract",
      "default_state": "NOT_CONNECTED",
      "risk_class": "READ_ONLY",
      "required_by": [],
      "optional_for": [
        "gugun"
      ],
      "platforms": [
        "unspecified"
      ],
      "install_method": "provider-specific; see linked optional integrations",
      "verification_method": "provider evidence_ref + employee scope + autonomy/approval router",
      "artifact_ref": "config/capabilities.json"
    },
    {
      "id": "ads.google.write",
      "kind": "adapter",
      "description": "Google Ads mutation",
      "source_refs": [
        {
          "source_id": "project:nyobakantorai",
          "source_commit": null,
          "license": "MIT"
        }
      ],
      "usage_mode": "provider-neutral-contract",
      "default_state": "NOT_CONNECTED",
      "risk_class": "PAID_ACTION",
      "required_by": [],
      "optional_for": [
        "gugun"
      ],
      "platforms": [
        "unspecified"
      ],
      "install_method": "provider-specific; see linked optional integrations",
      "verification_method": "provider evidence_ref + employee scope + autonomy/approval router",
      "artifact_ref": "config/capabilities.json"
    },
    {
      "id": "ads.meta.creative",
      "kind": "adapter",
      "description": "Meta creative draft/inspection",
      "source_refs": [
        {
          "source_id": "project:nyobakantorai",
          "source_commit": null,
          "license": "MIT"
        }
      ],
      "usage_mode": "provider-neutral-contract",
      "default_state": "NOT_CONNECTED",
      "risk_class": "READ_ONLY",
      "required_by": [],
      "optional_for": [
        "maya"
      ],
      "platforms": [
        "unspecified"
      ],
      "install_method": "provider-specific; see linked optional integrations",
      "verification_method": "provider evidence_ref + employee scope + autonomy/approval router",
      "artifact_ref": "config/capabilities.json"
    },
    {
      "id": "ads.meta.insights",
      "kind": "adapter",
      "description": "Meta Ads performance insights",
      "source_refs": [
        {
          "source_id": "project:nyobakantorai",
          "source_commit": null,
          "license": "MIT"
        }
      ],
      "usage_mode": "provider-neutral-contract",
      "default_state": "NOT_CONNECTED",
      "risk_class": "READ_ONLY",
      "required_by": [],
      "optional_for": [
        "maya"
      ],
      "platforms": [
        "unspecified"
      ],
      "install_method": "provider-specific; see linked optional integrations",
      "verification_method": "provider evidence_ref + employee scope + autonomy/approval router",
      "artifact_ref": "config/capabilities.json"
    },
    {
      "id": "ads.meta.media",
      "kind": "adapter",
      "description": "Meta media upload/library bridge",
      "source_refs": [
        {
          "source_id": "project:nyobakantorai",
          "source_commit": null,
          "license": "MIT"
        }
      ],
      "usage_mode": "provider-neutral-contract",
      "default_state": "NOT_CONNECTED",
      "risk_class": "EXTERNAL_WRITE",
      "required_by": [],
      "optional_for": [
        "maya"
      ],
      "platforms": [
        "unspecified"
      ],
      "install_method": "provider-specific; see linked optional integrations",
      "verification_method": "provider evidence_ref + employee scope + autonomy/approval router",
      "artifact_ref": "config/capabilities.json"
    },
    {
      "id": "ads.meta.read",
      "kind": "adapter",
      "description": "Meta Ads account/campaign read",
      "source_refs": [
        {
          "source_id": "project:nyobakantorai",
          "source_commit": null,
          "license": "MIT"
        }
      ],
      "usage_mode": "provider-neutral-contract",
      "default_state": "NOT_CONNECTED",
      "risk_class": "READ_ONLY",
      "required_by": [],
      "optional_for": [
        "maya"
      ],
      "platforms": [
        "unspecified"
      ],
      "install_method": "provider-specific; see linked optional integrations",
      "verification_method": "provider evidence_ref + employee scope + autonomy/approval router",
      "artifact_ref": "config/capabilities.json"
    },
    {
      "id": "ads.meta.write",
      "kind": "adapter",
      "description": "Meta campaign/ad mutation",
      "source_refs": [
        {